{
  "id": "dlv_0b5d1f8e-3a77-4e2c-9f10-6c2a8e7b5d33",
  "kind": "branch.pushed",
  "channel": "channel.repo",
  "occurred_at": "2026-10-10T09:12:00Z",
  "received_at": "2026-10-10T09:12:01Z",
  "context": {
    "repository": "acme/taktus",
    "branch": "main",
    "head": "654261d",
    "paths": [
      "docs/roadmap.md",
      "docs/status.md"
    ]
  }
}
